Job Id,Job URL,Job Salary Range,Job Employment Type,Job Posting Date,Job Title,Job Description,skills,Company,Job Industry,Job Minimum Experience,Work Type,Min Salary (K),Max Salary (K),Average Salary (K),Salary Range (K),Year-Quarter,Broader Category
MCF-2024-1478910,https://www.mycareersfuture.gov.sg/job/information-technology/enterprise-service-desk-analyst-gmp-technologies-a0604f48302b5a92f4274fb98f13b413?source=MCF&event=Search,"$6,000to$7,000","Contract, Full Time",2024-10-07,Enterprise Service Desk Analyst,"Responsibilities:
Overall responsible for the support to customers, execution of Standard Operating Procedures related to ITIL Processes such as Incident Management, Event Management and Request Fulfillment
Manage Major Incidents including management of customer & internal communications, management of internal and external communication bridges with our top-tier customers and escalations up to leadership level.
Coordinate and collaborate with internal teams to facilitate timely incident resolution and request fulfillment.
Invoke and manage crisis and security management processes.
Maintain accurate logs, incident reports and provide comprehensive updates to stakeholders.
Document all actions in accordance with standard company policies and procedures.
Act as the senior on shift and ensure proper shift handovers.

Requirements:
Diploma or Degree in Computer Science/Information Technology, Engineering (Computer/Telecommunication) or equivalent
3 years proven experience in managing all aspects of Major Incident.
At least 4 years of experience in telecommunications within a large-scale business environment.
At least 4 years of experience in a customer support role, preferably in a technical support or service desk environment.
Experience with developing training programs and delivering training.
ITIL V4 Foundation certificate and experience working with ServiceNow.
Agile, Six Sigma or related certifications
Having experience in the aviation sector is beneficial.

Additional info:
Under 12 months contract, renewable
Ability to work in a shift-based schedule, including weekends and holidays, to provide 24/7 coverage. Timing between 8am to 8pm (non-night shift)

To apply, please visit www.gmprecruit.com and search for Job Reference: 23981

To learn more about this opportunity, please contact Yingying at yingying.lai@gmprecruit.com

We regret that only shortlisted candidates will be notified.

GMP Technologies (S) Pte Ltd | EA Licence: 11C3793 | EA Personnel: Lai Yingying | Registration No: R1110239","['Service Desk Management', 'Aviation', 'Customer Support', 'Agile', 'IT-Service desk', 'IT-Security', 'Incidents Of Ownership', 'Security Management', 'Service Desk', 'Telecommunications', 'Crisis Management', 'ITIL', 'ServiceNow', 'Six Sigma', 'Incident Management', 'Technical Support']",Gmp Technologies (S) Pte Ltd,Information Technology,4.0,Contract,72.0,84.0,78.0,12.0,2024Q4,Information Technology
MCF-2024-1478801,https://www.mycareersfuture.gov.sg/job/sales/sales-executive-ih-pasona-singapore-95335b92ed5b562f33338fa7647ef767?source=MCF&event=Search,"$4,500to$5,500","Permanent, Full Time",2024-10-07,Sales Executive  Ih,"Company: Chemicals Trading Company
Location: City (Near Telok Ayer & Raffles Place MRT Station)
Position: Sales Executive (Japanese Speaking) (Job ID: 19049)
Job Description:
- Handling of existing customers accounts and relationship in Pharmaceutical, Diagnostic industry (80%)
- Development of new customers in Pharmaceutical, Diagnostic, Chemicals industry (20%)
- Liaising with Japan suppliers and HQ regarding technical specifications of products.
- Preparation of quotations, clarification of technical specifications with customers.
- Establish clear short and long-term goals for the business
- Preparing of monthly sales reports and forecast
Job Requirements:
- Minimum Bachelor's Degree in Chemistry or related discipline
- Japanese Language skill is preferred to liaise effectively with native stakeholders
- Minimum 2 years of relevant sales experience in chemical industry
- Experience in Japanese working environment will be advantageous
- Overseas trips to regional countries such as India will be required

Interested applicants please send your resume to irfan@pasona.com.sg with email subject header ""Job Application for Sales Executive (Japanese Speaking) (Job ID: 19049)"".

We regret that only shortlisted candidates will be notified. Other applications will be updated to our database for future job opportunities.

By submitting any resumes or applications to Pasona Singapore Pte. Ltd., you are considered to have read and agreed on the terms of our Privacy Policy, and consented to us collecting, using, retaining, disclosing your personal information to the prospective employers for their consideration.

Effective from 1 October 2020 under the new Employment Agencies (EAs) Licence Conditions,
EAs will be required to collect the personal data (e.g. NRIC number number for overseas candidates) of applicants referred to employers for permanent or contract job positions of at least six months with a fixed monthly salary of S$3,300 and above.

PDPA requirements on collection, use, and disclosure of personal data would not be applicable to EAs that are collecting such information as it is a regulatory requirement by Ministry of Manpower.

Please find Privacy Policy Agreement from the below link.
https://www.pasona.com.sg/privacy.html

Irfan Harith Bin Ismail
EA Registration No: R22107184
Pasona Singapore Pte. Ltd.
1 Finlayson Green, ＃09-02, Singapore 049246
Direct: +65 6239-4221 | General: +65 6732-6933 | Fax: +65 6733-2761
Email: irfan@pasona.com.sg
URL: www.pasona.com.sg
EA License No: 90C4069","['Sales', 'Pre-sales', 'Japanese Language', 'Ability To Work Independently', 'Presales', 'Chemistry', 'B2B Sales', 'Sales Plan', 'Customer Relations', 'Japanese']",Pasona Singapore Pte. Ltd.,Sales / Retail,2.0,Permanent,54.0,66.0,60.0,12.0,2024Q4,Business
MCF-2024-1455682,https://www.mycareersfuture.gov.sg/job/general-management/sea-freight-operations-director-recruitpedia-544e907a8c7731704300431e4bbedfc9?source=MCF&event=Search,"$10,000to$13,000","Permanent, Full Time",2024-10-02,Sea Freight Operations Director,"Our client is a well-established MNC, market leader in the 3PL Logistics industry. Due to their current expansion plan, they are looking for Sea Freight Operations Director to join their Sea Freight team, in hopes of developing the current high performing team. They are located in the East - easily assessible.
Jobs Scope:
Formulates business strategies and plans in collaboration with senior management, aligning objectives with regional leadership approval.
Directs area targets to achieve or exceed revenue, volume, profit, and line profitability goals.
Manages synergies across business units and country operations.
Ensures company policies are enforced across the region.
Reviews and approves internal policies to align with business and legal standards.
Oversees long-term planning to support future growth, presenting plans for executive approval as needed.
Proposes and manages operational and capital expenditure budgets for executive review.
Monitors performance against objectives, making adjustments as necessary to meet goals.
Leads negotiations and investigations related to mergers, joint ventures, and acquisitions with executive oversight.
Represents the company in dealings with key stakeholders, including customers, suppliers, and government agencies.
Requirement:
Min 10 years of ocean freight experience in managerial level
Degree in any discipline
Good communication and presentation skills
Interested candidates who wish to apply for the advertised position, please click APPLY NOW or email an updated copy of your resume/cv.
We regret that only shortlisted candidate will be notified.
Email Address: jobs@recruitpedia.sg
EA License No: 19C9682
EA Personnel No: R2198636
EA Personnel Name: Oh Puey Xin","['Coaching', 'Budgets', 'Leadership', '3PL', 'Mergers', 'Joint Ventures', 'Project Management', 'Freight', 'Sea freight, experience', 'Accountability', 'Presentation Skills', 'Capital', 'Sea Freight', 'Customer Service', 'Acquisitions', 'Performance Management', 'Service Delivery']",Recruitpedia Pte. Ltd.,"General Management, Logistics / Supply Chain",10.0,Permanent,120.0,156.0,138.0,36.0,2024Q4,Business
MCF-2024-1474961,https://www.mycareersfuture.gov.sg/job/customer-service/temp-health-product-promoter-12-per-hour-og-people-bugis-fridays-sundays-recruitpedia-74b36adcd39336c266bbcd7ea313f78b?source=MCF&event=Search,"$1,400to$1,500","Temporary, Contract",2024-10-06,Temp Health Product Promoter  Og People & Bugis  Fridays To Sundays,"Temp Health Product Promoter
Training will be provided
Salary: $12/hour
Location: OG People's Park/Bugis
Working hours: Fridays to Sundays, retail hours
Commitment period: ASAP~2/3 Months
Responsibilities:
1. Proactive in engaging with customers
2. ⁠Listening to customer’s needs & wants and help them to find the right products
3. ⁠To make sure the product display & booth tidy
4. ⁠Able to deliver the correct and meaningful interactions with the customers
5. ⁠Able to deliver good sales performance
6. ⁠Take into account to manage the inventories

Interested candidates you may whatsapp PM to 89154026 with the following details:
Name:
Education:
Location:
Commitment Period:

EA License No: 19C9682
EA Personnel No: R23115655
EA Personnel Name: Michelle Yeo Swee Xiang","['Sales', 'Interpersonal Skills', 'Selling', 'Merchandising', 'Good Communication Skills', 'Cashiering', 'Communication Skills', 'Team Player', 'Customer Service', 'Able To Work Independently', 'Brand Awareness']",Recruitpedia Pte. Ltd.,"Customer Service, Marketing / Public Relations, Sales / Retail",0.0,Temporary,16.799999999999997,18.0,17.4,1.2000000000000028,2024Q4,Business
MCF-2024-1480429,https://www.mycareersfuture.gov.sg/job/manufacturing/key-account-manager-recruitpedia-829596ee8cc1c2625edb405bff54ca77?source=MCF&event=Search,"$5,000to$10,000","Permanent, Full Time",2024-10-07,Key Account Manager,"Our client is a manufacturer in Oil & Gas industry. Due to business needs, they are now recruiting a Key Account Manager to join their sales team. They are located in the West - easily accessible.

Responsibility:
Build, maintain, and grow strong relationships with both current and prospective customers in Southeast Asia.
Respond promptly to customer inquiries regarding pricing and delivery, either verbally or in writing.
Handle customer orders through Stratix, including order entry, contract review, and invoicing.
Provide management with regular reports on customer needs, issues, market trends, competitor activities, and potential threats or new opportunities.
Stay informed about the competition by tracking market data on pricing, products, and lead times.
Address customer complaints by investigating and resolving issues efficiently.
Support other departments to help meet overall company goals and objectives.

Requirements:
Min 3 years of key account management experience in Oil & Gas Industry
Min Diploma and above
Interested candidates who wish to apply for the advertised position, please click APPLY NOW or email an updated copy of your resume/cv.
We regret that only shortlisted candidate will be notified.

Email Address: jobs@recruitpedia.sg
Recruitpedia Pte. Ltd.
EA License No. 19C9682
EA Reg. No. R2198636 (Oh Puey Xin)","['Sales', 'Customer Service Oriented', 'Recruiting', 'Customer Relationships', 'Invoicing', 'Account Management Experience', 'Writing', 'Communication Skills', 'Customer Service', 'Key Account Management', 'Pricing']",Recruitpedia Pte. Ltd.,"Manufacturing, Marketing / Public Relations, Sales / Retail",3.0,Permanent,60.0,120.0,90.0,60.0,2024Q4,Business
MCF-2024-1480357,https://www.mycareersfuture.gov.sg/job/accounting/fpa-accountant-manufacturing-mnc-recruitpedia-140e265c7ab542c1d3acf88b321fa16c?source=MCF&event=Search,"$5,000to$6,000","Permanent, Full Time",2024-10-07,Fp&A Accountant  Manufacturing Mnc,"Our client is a global manufacturer. Due to business needs, they are now recruiting a FP&A Accountant to be part of their FP&A team for ongoing transformation projects. They are located in the North Area - easily accessible.

Responsibility:
Coordinate the preparation, compilation, and analysis of the Annual Budget prior to its submission to the corporate office.
Analyze financial variances and take a proactive approach by conducting meetings with operations departments to review and discuss monthly forecast performance.
Synthesize complex data from various sources and transform it into comprehensive management reports.
Scrutinize a wide range of records and engage with various departments to ensure data accuracy and reliability.
Oversee SOX compliance and address internal and external audit queries.
Enhance processes and actively participate in ad-hoc LEAN projects.
Requirements:
Min Degree in Finance / Accountancy or any related field
Minimum 5 years experience in FP&A and SOX
Experience in manufacturing industry is a bonus
Interested candidates who wish to apply for the advertised position, please click APPLY NOW or email an updated copy of your resume/cv.
We regret that only shortlisted candidate will be notified.
Email Address: jobs@recruitpedia.sg
Recruitpedia Pte. Ltd.
EA License No. 19C9682
EA Reg. No. R2198636 (Oh Puey Xin)","['Forecasting', 'Cost Accounting', 'External Audit', 'Team Handling', 'Microsoft Excel', 'Due Diligence', 'Consolidation', 'Financial Planning', 'SOX Compliancy', 'Variance Analysis', 'Reliability', 'Financial Modelling', 'SOX', 'Budgeting', 'Manufacturing', 'People Management', 'Financial Reporting']",Recruitpedia Pte. Ltd.,Accounting / Auditing / Taxation,5.0,Permanent,60.0,72.0,66.0,12.0,2024Q4,Business
MCF-2024-1480245,https://www.mycareersfuture.gov.sg/job/logistics/business-analyst-assistant-manager-recruitpedia-d1084d9132bc4cbcf9365dea10d8b215?source=MCF&event=Search,"$5,000to$6,000","Permanent, Full Time",2024-10-07,Business Analyst Assistant Manager,"Our client is a well-established MNC, market leader in the 3PL Logistics industry. Due to their current expansion plan, they are looking for Business Analyst Assistant Manager to join their warehouse team, in hopes of developing the current high performing team. They are located in the East - easily assessible.

Responsibilities Business Analyst Assistant Manager:
Performing data analysis and validation tasks as required.
Employing Python, R, VBA, PowerAutomate, and other software to automate comprehensive scorecard reports across diverse business sectors.
Crafting and managing several Power BI data visualizations for day-to-day activities, key performance indicators (KPIs), and financial assessments.
Creating PowerApps to collect crucial data currently lacking, with a focus on boosting efficiency, justifying costs, and identifying anomalies.
Offering technical support and resolving platform issues.

Requirements:
Min Degree in related study with min 2 - 3 years of relevant experience (dealing with different business unit)
Proficient in automation tools such as PowerBI, Tableau and VBA
Good communication and presentation skills

Interested candidates who wish to apply for the advertised position, please click APPLY NOW or email an updated copy of your resume/cv.
We regret that only shortlisted candidate will be notified.
Email: jobs@recruitpedia.sg

Recruitpedia Pte. Ltd.
EA License No. 19C9682
EA Reg. No. R2198636 (Oh Puey Xin)","['Tableau', 'Account Management', 'Warehousing', 'Leadership', 'Data Analysis', '3PL', 'Supply Chain', 'Automation Tools', 'Fast-paced', 'VBA', 'PowerBI', 'Python', 'Teamoriented', 'Monitor Budgets', 'Presentation Skills', 'Business Analyst', 'Customer Service', 'Power BI', 'People Management', 'Technical Support']",Recruitpedia Pte. Ltd.,Logistics / Supply Chain,3.0,Permanent,60.0,72.0,66.0,12.0,2024Q4,Business
MCF-2024-1478882,https://www.mycareersfuture.gov.sg/job/information-technology/software-engineer-gmp-technologies-12c2b95cc7eae0480d64fb9912a6fa4c?source=MCF&event=Search,"$5,000to$6,000","Permanent, Full Time",2024-10-07,Software Engineer,"Responsibilities:
Design and develop software for automated computer vision systems.
Develop software for GUI, big data management, and multi-threaded programming.
Create and refine image processing and computer vision algorithms.
Participate in the complete Software Development Life Cycle (SDLC).

Requirements:
PhD, Master’s, or Bachelor’s degree in an engineering discipline.
Proficiency in C++ is required.
Strong expertise in vision inspection, computer vision, and image processing is essential.
Experience with programming in the Visual Studio Development Environment.
Familiarity with C# is a plus.
Knowledge of Deep Learning (AI) for defect classification is an advantage.
Excellent written and verbal communication skills in English.

To apply, please visit www.gmprecruit.com and search for Job Reference: 24876

To learn more about this opportunity, please contact Yingying at yingying.lai@gmprecruit.com

We regret that only shortlisted candidates will be notified.

GMP Technologies (S) Pte Ltd | EA Licence: 11C3793 | EA Personnel: Lai Yingying | Registration No: R1110239","['Deep learning', 'Automated Systems Design', 'GUI', 'Image Processing', 'Artificial Intelligence', 'SDLC', 'Computer Vision', 'C#', 'Software Development', 'C++', 'Visual Studio']",Gmp Technologies (S) Pte Ltd,Information Technology,2.0,Permanent,60.0,72.0,66.0,12.0,2024Q4,Information Technology
MCF-2024-1472113,https://www.mycareersfuture.gov.sg/job/engineering/lead-principal-engineer-oil-gas-recruitpedia-252ce8145b369213d631d17bafaf72fc?source=MCF&event=Search,"$9,000to$11,000",Permanent,2024-10-05,Lead  Principal Engineer  Oil & Gas,"Our client is from Oil and Gas industry. They are looking for a Lead / Principal Engineer (Electrical) for the next phase of their business. They are located in West.

Duties:
Lead Electrical discipline for CAPEX projects, supervising consultants, contractors, and vendors.
Develop and issue Electrical design bases, specifications, and scopes of work.
Review and evaluate proposals from consultants, contractors, and vendors.
Approve Electrical deliverables and develop necessary project documents.
Support regulatory approval processes.
Collaborate with project management and engineering teams.
Witness factory acceptance tests (FAT).
Ensure accuracy of engineering databases (e.g., SmartPlant tools).
Review and document as-built deliverables.
Follow Quality Management System and QA plans.
Requirements
Min Bachelor’s Degree in Electrical Engineering or any relevant field.
Min 15 - 20 years’ experience in Oil & Gas industry, with exposure in LNG industry.
Interested candidates who wish to apply for the advertised position, please click APPLY NOW or email an updated copy of your resume/cv.
We regret that only shortlisted candidate will be notified.
Email Address: jobs@recruitpedia.sg
Recruitpedia Pte. Ltd.
EA License No: 19C9682
EA Personnel No: R2198636 (Oh Puey Xin)","['Plant Maintenance', 'Asset Management', 'Construction', 'Pipelines', 'Electrical Design', 'API 570', 'Electrical', 'Administration', 'Strategy', 'Compliance', 'Pressure', 'Accountability', 'Statistics', 'Pumps', 'Systems Engineering', 'Electrical Engineering', 'CAD', 'Chemical Engineering', 'Commissioning', 'Mechanical Engineering']",Recruitpedia Pte. Ltd.,Engineering,5.0,Permanent,108.0,132.0,120.0,24.0,2024Q4,Engineering
MCF-2024-1478723,https://www.mycareersfuture.gov.sg/job/engineering/maintenance-engineer-gmp-technologies-a67c8afcd83d7c4b4a0959474e9d9dfe?source=MCF&event=Search,"$3,750to$4,200","Permanent, Full Time",2024-10-07,Maintenance Engineer,"Responsibilities:
Plan and implement the preventive and corrective programs within schedule in compliance to standards and requirements.
Perform troubleshooting/failure analysis to determine the cause of failure for kiosk machines.
Development of SOP and Work Instructions to technicians.
Develop and perform Risk Assessments to evaluate mitigation measures for all maintenance activities.
Proper documentation system to achieve all jobs internally for sharing and audit purposes.
Assist in the identification, planning, and reviewing of necessary training needs for mentoring and coaching of maintenance staff.
Preparation and writing maintenance and spare consumption report.
Requirements:
Degree in Mechanical / Electrical / Mechatronics Engineering with 2–3 years of relevant work experience.
Candidate without working experience and willing to be trained will be considered.
Possess experiences in maintainging kiosk machines, and card issuers machines.
Proficiency in Excel, Words, and Powerpoint.
Good teamworks, problem-solving, and maintain customer satisfactions.

To apply, please click ""Apply Now"" or visit www.gmprecruit.com and search for job reference: 21892

GMP Technologies (S) Pte Ltd (EA Licence: 11C3793) | EA Personnel: Novita Widjaja (Reg No.: R22105960)","['Mentoring', 'Troubleshooting', 'Risk Assessment', 'Documentation', 'GMP', 'Electrical', 'PowerPoint', 'fault investigation', 'Equipment Maintenance', 'Compliance', 'Excel', 'Audit', 'Mechanical Engineering', 'Calibration']",Gmp Technologies (S) Pte Ltd,Engineering,2.0,Permanent,45.0,50.400000000000006,47.7,5.400000000000006,2024Q4,Engineering
MCF-2024-1481548,https://www.mycareersfuture.gov.sg/job/engineering/production-engineer-manufacturing-mnc-west-recruitpedia-ac56a6be67887923f54258395bc388c6?source=MCF&event=Search,"$3,000to$6,000",Permanent,2024-10-07,Production Engineer  West,"Our Client is a leader in the Manufacturing MNC. Due to their current expansion plan, they are looking for a Production Engineer to join their team, in hopes of developing the current high performing team. They are located in the West.

Responsibility:
Responsible in production planning and control processes
Handle manpower allocation/planning and participate in HR-related activities.
Manage order processing and related documentation tasks.
Work closely with Sales and Quality departments to resolve production issues.
Track and monitor production schedules to meet delivery timelines.
Prepare and submit detailed monthly production reports.
Involve in process improvement initiatives.
Any other ad-hoc duties as assigned.
Requirement:
Minimum Diploma in Engineering related studies or equivalent
Minimum 2 years relevant experience
Proficient in Microsoft Office application
Interested candidates who wish to apply for the advertised position, please click APPLY NOW or email an updated copy of your resume/cv.
We regret that only shortlisted candidate will be notified.

Email Address: jobs@recruitpedia.sg

Recruitpedia Pte. Ltd.
EA License No. 19C9682
EA Reg. No. R23115553 (Lai Hor Yan)","['Troubleshooting', 'Microsoft Office', 'Quality Control', 'Analytical Skills', 'Process Improvement', 'Production Planning', 'Equipment Maintenance', 'Time Management', 'Human Resources', 'Manufacturing']",Recruitpedia Pte. Ltd.,Engineering,2.0,Permanent,36.0,72.0,54.0,36.0,2024Q4,Engineering
MCF-2024-1481549,https://www.mycareersfuture.gov.sg/job/sales/product-development-specialist-mnc-south-recruitpedia-c271016aecb3f782c5952fa85213bc50?source=MCF&event=Search,"$3,500to$4,700",Full Time,2024-10-07,Product Development Specialist  South,"Our client is a well-established MNC, market leader in the Wholesale industry. They are looking for a Senior Product Development Specialist to assist their team for the next phase of their business. They are located in the South area – easily accessible.

Responsibilities:
Responsible for product lifecycle management and planning.
Provide support for end-to-end product launches.
Responsible for overseeing a wide range of consumer products/appliances.
Participate in events as needed.
Manage the development of new products, including feasibility assessments, value chain analysis, and tracking progress throughout the development lifecycle.
Collaborate with the sales team to plan the sales budget.
Conduct regular market and competitor research.
System management for updating records and contracts.
Support the preparation of monthly sales reports.
All other ad hoc duties as assign
Requirements:
Minimum Diploma in Business Administration or other relevant field of studies
Minimum 1-3 years of relevant experiences
Interested candidates who wish to apply for the advertised position, please click APPLY NOW or email an updated copy of your resume/cv.
We regret that only shortlisted candidate will be notified.

Recruitpedia Pte. Ltd.
EA License No: 19C9682
EA Personnel No: R23115674 (Chong Jia Jia)","['Market Research', 'Management Skills', 'Data Analysis', 'Product Marketing', 'Value Chain Analysis', 'Product Lifecycle Management', 'Product Management', 'SAP', 'Communication Skills', 'Product Development']",Recruitpedia Pte. Ltd.,"Sales / Retail, Wholesale Trade",2.0,Full-Time,42.0,56.400000000000006,49.2,14.400000000000006,2024Q4,Business
